{
  "$schema": "https://json-schema.org/draft/2020-12/schema",
  "$id": "https://laminardb.dev/schemas/state-backend-redb-prescreen-result-v1.json",
  "title": "LaminarDB redb 4.1.0 bounded prescreen reviewed result v1",
  "description": "A final reviewed descriptor root. It embeds no raw artifacts, does not derive its own disposition, and cannot qualify, admit, select, or production-enable redb.",
  "type": "object",
  "additionalProperties": false,
  "required": [
    "schema_version",
    "notice",
    "record_class",
    "fixture_ineligible",
    "result_id",
    "status",
    "schema_validation_authorizes_decision",
    "external_attestation_verification_required",
    "run_class",
    "approval",
    "prior_smoke_result",
    "actual_bindings",
    "run_window",
    "schedule_summary",
    "bounds",
    "disposition",
    "artifacts",
    "mechanism_probe",
    "owners",
    "evidence_scope"
  ],
  "properties": {
    "schema_version": {"const": "state-backend-redb-prescreen-result/v1"},
    "notice": {"const": "NOT QUALIFICATION EVIDENCE"},
    "record_class": {"enum": ["prescreen_record", "synthetic_fixture"]},
    "fixture_ineligible": {"type": "boolean"},
    "result_id": {
      "type": "string",
      "minLength": 1,
      "maxLength": 128,
      "pattern": "^[a-z0-9][a-z0-9._/-]{0,127}$"
    },
    "status": {"const": "reviewed_prescreen_result"},
    "schema_validation_authorizes_decision": {"const": false},
    "external_attestation_verification_required": {"const": true},
    "run_class": {"enum": ["docker_smoke_no_decision", "native_prescreen_decision"]},
    "approval": {"$ref": "#/$defs/approvalDescriptor"},
    "prior_smoke_result": {
      "oneOf": [
        {"type": "null"},
        {"$ref": "#/$defs/priorSmokeResultDescriptor"}
      ]
    },
    "actual_bindings": {"$ref": "#/$defs/actualBindings"},
    "run_window": {"$ref": "#/$defs/runWindow"},
    "schedule_summary": {"$ref": "#/$defs/scheduleSummary"},
    "bounds": {"$ref": "#/$defs/bounds"},
    "disposition": {
      "enum": [
        "SMOKE_PASS",
        "SMOKE_FAIL",
        "PRESCREEN_PASS",
        "PRESCREEN_NO_GO",
        "DEFER",
        "REJECT_EXACT_PIN"
      ]
    },
    "artifacts": {"$ref": "#/$defs/artifacts"},
    "mechanism_probe": {
      "oneOf": [
        {"type": "null"},
        {"$ref": "#/$defs/mechanismProbeDescriptor"}
      ]
    },
    "owners": {"$ref": "#/$defs/postRunOwners"},
    "evidence_scope": {"$ref": "#/$defs/evidenceScope"}
  },
  "allOf": [
    {
      "if": {"properties": {"record_class": {"const": "synthetic_fixture"}}, "required": ["record_class"]},
      "then": {"properties": {"fixture_ineligible": {"const": true}}},
      "else": {"properties": {"fixture_ineligible": {"const": false}}}
    },
    {
      "if": {"properties": {"run_class": {"const": "docker_smoke_no_decision"}}, "required": ["run_class"]},
      "then": {
        "properties": {
          "prior_smoke_result": {"type": "null"},
          "disposition": {"enum": ["SMOKE_PASS", "SMOKE_FAIL", "DEFER"]},
          "mechanism_probe": {"type": "null"}
        }
      },
      "else": {
        "properties": {
          "prior_smoke_result": {"$ref": "#/$defs/priorSmokeResultDescriptor"},
          "disposition": {"enum": ["PRESCREEN_PASS", "PRESCREEN_NO_GO", "DEFER", "REJECT_EXACT_PIN"]},
          "mechanism_probe": {"$ref": "#/$defs/mechanismProbeDescriptor"}
        }
      }
    },
    {
      "if": {
        "properties": {
          "bounds": {
            "properties": {"hard_bound_hit": {"const": true}},
            "required": ["hard_bound_hit"]
          }
        },
        "required": ["bounds"]
      },
      "then": {"properties": {"disposition": {"const": "DEFER"}}}
    }
  ],
  "$defs": {
    "digest": {
      "type": "string",
      "pattern": "^[0-9a-f]{64}$",
      "not": {"const": "0000000000000000000000000000000000000000000000000000000000000000"}
    },
    "descriptor": {
      "type": "object",
      "additionalProperties": false,
      "required": ["role", "byte_length", "sha256", "media_type"],
      "properties": {
        "role": {
          "type": "string",
          "minLength": 1,
          "maxLength": 96,
          "pattern": "^[a-z0-9][a-z0-9._-]{0,95}$"
        },
        "byte_length": {"type": "integer", "minimum": 1, "maximum": 2147483648},
        "sha256": {"$ref": "#/$defs/digest"},
        "media_type": {
          "enum": [
            "application/json",
            "application/octet-stream",
            "application/spdx+json",
            "application/vnd.cyclonedx+json",
            "application/zip",
            "application/zstd",
            "text/markdown; charset=utf-8"
          ]
        }
      }
    },
    "approvalDescriptor": {
      "allOf": [
        {"$ref": "#/$defs/descriptor"},
        {"properties": {"role": {"const": "redb-prescreen-approval-record"}}, "required": ["role"]}
      ]
    },
    "priorSmokeResultDescriptor": {
      "allOf": [
        {"$ref": "#/$defs/descriptor"},
        {"properties": {"role": {"const": "redb-prescreen-reviewed-smoke-result"}}, "required": ["role"]}
      ]
    },
    "actualBindings": {
      "type": "object",
      "additionalProperties": false,
      "required": [
        "crate_archive",
        "protocol_bytes",
        "mechanism_note",
        "harness_source_archive",
        "harness_binary",
        "cargo_lock",
        "sbom",
        "build_manifest",
        "candidate_configuration",
        "target_identity",
        "preflight_record"
      ],
      "properties": {
        "crate_archive": {"$ref": "#/$defs/crateArchiveDescriptor"},
        "protocol_bytes": {"$ref": "#/$defs/protocolDescriptor"},
        "mechanism_note": {"$ref": "#/$defs/mechanismNoteDescriptor"},
        "harness_source_archive": {"$ref": "#/$defs/harnessSourceDescriptor"},
        "harness_binary": {"$ref": "#/$defs/harnessBinaryDescriptor"},
        "cargo_lock": {"$ref": "#/$defs/cargoLockDescriptor"},
        "sbom": {"$ref": "#/$defs/sbomDescriptor"},
        "build_manifest": {"$ref": "#/$defs/buildManifestDescriptor"},
        "candidate_configuration": {"$ref": "#/$defs/candidateConfigurationDescriptor"},
        "target_identity": {"$ref": "#/$defs/actualTargetDescriptor"},
        "preflight_record": {"$ref": "#/$defs/preflightRecordDescriptor"}
      }
    },
    "crateArchiveDescriptor": {
      "allOf": [
        {"$ref": "#/$defs/descriptor"},
        {
          "properties": {
            "role": {"const": "redb-4.1.0-crate-archive"},
            "byte_length": {"const": 188200},
            "sha256": {"const": "8e925444704b5f17d32bf42f5b6e2df050bceebc3dcd6e71cc73dafe8092e839"}
          },
          "required": ["role", "byte_length", "sha256"]
        }
      ]
    },
    "protocolDescriptor": {
      "allOf": [
        {"$ref": "#/$defs/descriptor"},
        {"properties": {"role": {"const": "redb-prescreen-protocol"}}, "required": ["role"]}
      ]
    },
    "mechanismNoteDescriptor": {
      "allOf": [
        {"$ref": "#/$defs/descriptor"},
        {"properties": {"role": {"const": "redb-exact-source-mechanism-note"}}, "required": ["role"]}
      ]
    },
    "harnessSourceDescriptor": {
      "allOf": [
        {"$ref": "#/$defs/descriptor"},
        {"properties": {"role": {"const": "redb-prescreen-harness-source"}}, "required": ["role"]}
      ]
    },
    "harnessBinaryDescriptor": {
      "allOf": [
        {"$ref": "#/$defs/descriptor"},
        {"properties": {"role": {"const": "redb-prescreen-harness-binary"}}, "required": ["role"]}
      ]
    },
    "cargoLockDescriptor": {
      "allOf": [
        {"$ref": "#/$defs/descriptor"},
        {"properties": {"role": {"const": "redb-prescreen-cargo-lock"}}, "required": ["role"]}
      ]
    },
    "sbomDescriptor": {
      "allOf": [
        {"$ref": "#/$defs/descriptor"},
        {"properties": {"role": {"const": "redb-prescreen-sbom"}}, "required": ["role"]}
      ]
    },
    "buildManifestDescriptor": {
      "allOf": [
        {"$ref": "#/$defs/descriptor"},
        {"properties": {"role": {"const": "redb-prescreen-build-manifest"}}, "required": ["role"]}
      ]
    },
    "candidateConfigurationDescriptor": {
      "allOf": [
        {"$ref": "#/$defs/descriptor"},
        {"properties": {"role": {"const": "redb-prescreen-candidate-configuration"}}, "required": ["role"]}
      ]
    },
    "actualTargetDescriptor": {
      "allOf": [
        {"$ref": "#/$defs/descriptor"},
        {"properties": {"role": {"const": "redb-prescreen-actual-target-identity"}}, "required": ["role"]}
      ]
    },
    "preflightRecordDescriptor": {
      "allOf": [
        {"$ref": "#/$defs/descriptor"},
        {"properties": {"role": {"const": "redb-prescreen-actual-preflight-record"}}, "required": ["role"]}
      ]
    },
    "runWindow": {
      "type": "object",
      "additionalProperties": false,
      "required": ["started_at_utc", "ended_at_utc", "duration_ns"],
      "properties": {
        "started_at_utc": {"type": "string", "format": "date-time"},
        "ended_at_utc": {"type": "string", "format": "date-time"},
        "duration_ns": {
          "type": "integer",
          "minimum": 1,
          "maximum": 18000000000000
        }
      }
    },
    "boundedCount": {"type": "integer", "minimum": 0, "maximum": 512},
    "scheduleSummary": {
      "type": "object",
      "additionalProperties": false,
      "required": [
        "planned_attempts",
        "executed_attempts",
        "valid_attempts",
        "invalid_attempts",
        "retained_transaction_samples",
        "retained_artifact_bytes"
      ],
      "properties": {
        "planned_attempts": {"$ref": "#/$defs/boundedCount"},
        "executed_attempts": {"$ref": "#/$defs/boundedCount"},
        "valid_attempts": {"$ref": "#/$defs/boundedCount"},
        "invalid_attempts": {"$ref": "#/$defs/boundedCount"},
        "retained_transaction_samples": {
          "type": "integer",
          "minimum": 0,
          "maximum": 250000
        },
        "retained_artifact_bytes": {
          "type": "integer",
          "minimum": 0,
          "maximum": 2147483648
        }
      }
    },
    "bounds": {
      "type": "object",
      "additionalProperties": false,
      "required": ["hard_bound_hit", "hit_codes"],
      "properties": {
        "hard_bound_hit": {"type": "boolean"},
        "hit_codes": {
          "type": "array",
          "maxItems": 16,
          "uniqueItems": true,
          "items": {
            "enum": [
              "campaign_wall_clock",
              "attempt_deadline",
              "transaction_samples",
              "artifact_bytes",
              "physical_allocation",
              "memory",
              "file_descriptors",
              "preflight",
              "target_noise",
              "clock_integrity",
              "actuator_ambiguity",
              "oracle_failure",
              "validator_failure"
            ]
          }
        }
      },
      "allOf": [
        {
          "if": {"properties": {"hard_bound_hit": {"const": true}}, "required": ["hard_bound_hit"]},
          "then": {"properties": {"hit_codes": {"minItems": 1}}},
          "else": {"properties": {"hit_codes": {"maxItems": 0}}}
        }
      ]
    },
    "artifacts": {
      "type": "object",
      "additionalProperties": false,
      "required": ["raw_run_manifest", "artifact_index", "independent_validator_report", "oracle_report"],
      "properties": {
        "raw_run_manifest": {"$ref": "#/$defs/rawRunManifestDescriptor"},
        "artifact_index": {"$ref": "#/$defs/artifactIndexDescriptor"},
        "independent_validator_report": {"$ref": "#/$defs/validatorReportDescriptor"},
        "oracle_report": {"$ref": "#/$defs/oracleReportDescriptor"}
      }
    },
    "rawRunManifestDescriptor": {
      "allOf": [
        {"$ref": "#/$defs/descriptor"},
        {"properties": {"role": {"const": "redb-prescreen-raw-run-manifest"}}, "required": ["role"]}
      ]
    },
    "artifactIndexDescriptor": {
      "allOf": [
        {"$ref": "#/$defs/descriptor"},
        {"properties": {"role": {"const": "redb-prescreen-artifact-index"}}, "required": ["role"]}
      ]
    },
    "validatorReportDescriptor": {
      "allOf": [
        {"$ref": "#/$defs/descriptor"},
        {"properties": {"role": {"const": "redb-prescreen-independent-validator-report"}}, "required": ["role"]}
      ]
    },
    "oracleReportDescriptor": {
      "allOf": [
        {"$ref": "#/$defs/descriptor"},
        {"properties": {"role": {"const": "redb-prescreen-independent-oracle-report"}}, "required": ["role"]}
      ]
    },
    "mechanismProbeDescriptor": {
      "allOf": [
        {"$ref": "#/$defs/descriptor"},
        {"properties": {"role": {"const": "redb-prescreen-bounded-mechanism-probe-result"}}, "required": ["role"]}
      ]
    },
    "workloadPostRunAttestationDescriptor": {
      "allOf": [
        {"$ref": "#/$defs/descriptor"},
        {"properties": {"role": {"const": "redb-prescreen-workload-owner-post-run-attestation"}}, "required": ["role"]}
      ]
    },
    "operationsPostRunAttestationDescriptor": {
      "allOf": [
        {"$ref": "#/$defs/descriptor"},
        {"properties": {"role": {"const": "redb-prescreen-operations-owner-post-run-attestation"}}, "required": ["role"]}
      ]
    },
    "workloadPostRunOwner": {
      "type": "object",
      "additionalProperties": false,
      "required": ["role", "owner_id", "decision", "reviewed_at_utc", "attestation"],
      "properties": {
        "role": {"const": "workload_owner"},
        "owner_id": {
          "type": "string",
          "minLength": 16,
          "maxLength": 128,
          "pattern": "^workload-owner/[a-z0-9][a-z0-9._@/-]{0,112}$"
        },
        "decision": {"const": "accept_reviewed_result"},
        "reviewed_at_utc": {"type": "string", "format": "date-time"},
        "attestation": {"$ref": "#/$defs/workloadPostRunAttestationDescriptor"}
      }
    },
    "operationsPostRunOwner": {
      "type": "object",
      "additionalProperties": false,
      "required": ["role", "owner_id", "decision", "reviewed_at_utc", "attestation"],
      "properties": {
        "role": {"const": "operations_owner"},
        "owner_id": {
          "type": "string",
          "minLength": 18,
          "maxLength": 128,
          "pattern": "^operations-owner/[a-z0-9][a-z0-9._@/-]{0,110}$"
        },
        "decision": {"const": "accept_reviewed_result"},
        "reviewed_at_utc": {"type": "string", "format": "date-time"},
        "attestation": {"$ref": "#/$defs/operationsPostRunAttestationDescriptor"}
      }
    },
    "postRunOwners": {
      "type": "object",
      "description": "Role-specific ID namespaces prevent identical identifiers; the external verifier must still resolve them to two distinct authorized principals and verify both detached attestations.",
      "additionalProperties": false,
      "required": ["workload_owner", "operations_owner"],
      "properties": {
        "workload_owner": {"$ref": "#/$defs/workloadPostRunOwner"},
        "operations_owner": {"$ref": "#/$defs/operationsPostRunOwner"}
      }
    },
    "evidenceScope": {
      "type": "object",
      "additionalProperties": false,
      "required": [
        "prescreen_only",
        "qualification_eligible",
        "candidate_admission_eligible",
        "backend_selection_eligible",
        "production_eligible",
        "independent_soak_eligible",
        "c1_c2_c3_eligible",
        "fault_endurance_eligible",
        "checkpoint_exactly_once_eligible",
        "source_sink_delivery_eligible"
      ],
      "properties": {
        "prescreen_only": {"const": true},
        "qualification_eligible": {"const": false},
        "candidate_admission_eligible": {"const": false},
        "backend_selection_eligible": {"const": false},
        "production_eligible": {"const": false},
        "independent_soak_eligible": {"const": false},
        "c1_c2_c3_eligible": {"const": false},
        "fault_endurance_eligible": {"const": false},
        "checkpoint_exactly_once_eligible": {"const": false},
        "source_sink_delivery_eligible": {"const": false}
      }
    }
  }
}
