{
  "schema_version": "state-backend-redb-prescreen-result/v1",
  "notice": "NOT QUALIFICATION EVIDENCE",
  "record_class": "synthetic_fixture",
  "fixture_ineligible": true,
  "result_id": "synthetic-fixture/redb-docker-smoke-result",
  "status": "reviewed_prescreen_result",
  "schema_validation_authorizes_decision": false,
  "external_attestation_verification_required": true,
  "run_class": "docker_smoke_no_decision",
  "approval": {
    "role": "redb-prescreen-approval-record",
    "byte_length": 2121,
    "sha256": "1111111111111111111111111111111111111111111111111111111111111111",
    "media_type": "application/json"
  },
  "prior_smoke_result": null,
  "actual_bindings": {
    "crate_archive": {
      "role": "redb-4.1.0-crate-archive",
      "byte_length": 188200,
      "sha256": "8e925444704b5f17d32bf42f5b6e2df050bceebc3dcd6e71cc73dafe8092e839",
      "media_type": "application/octet-stream"
    },
    "protocol_bytes": {
      "role": "redb-prescreen-protocol",
      "byte_length": 2222,
      "sha256": "2222222222222222222222222222222222222222222222222222222222222222",
      "media_type": "text/markdown; charset=utf-8"
    },
    "mechanism_note": {
      "role": "redb-exact-source-mechanism-note",
      "byte_length": 2323,
      "sha256": "3333333333333333333333333333333333333333333333333333333333333333",
      "media_type": "text/markdown; charset=utf-8"
    },
    "harness_source_archive": {
      "role": "redb-prescreen-harness-source",
      "byte_length": 2424,
      "sha256": "4444444444444444444444444444444444444444444444444444444444444444",
      "media_type": "application/zip"
    },
    "harness_binary": {
      "role": "redb-prescreen-harness-binary",
      "byte_length": 2525,
      "sha256": "5555555555555555555555555555555555555555555555555555555555555555",
      "media_type": "application/octet-stream"
    },
    "cargo_lock": {
      "role": "redb-prescreen-cargo-lock",
      "byte_length": 2626,
      "sha256": "6666666666666666666666666666666666666666666666666666666666666666",
      "media_type": "application/octet-stream"
    },
    "sbom": {
      "role": "redb-prescreen-sbom",
      "byte_length": 2727,
      "sha256": "7777777777777777777777777777777777777777777777777777777777777777",
      "media_type": "application/spdx+json"
    },
    "build_manifest": {
      "role": "redb-prescreen-build-manifest",
      "byte_length": 2828,
      "sha256": "8888888888888888888888888888888888888888888888888888888888888888",
      "media_type": "application/json"
    },
    "candidate_configuration": {
      "role": "redb-prescreen-candidate-configuration",
      "byte_length": 2929,
      "sha256": "9999999999999999999999999999999999999999999999999999999999999999",
      "media_type": "application/json"
    },
    "target_identity": {
      "role": "redb-prescreen-actual-target-identity",
      "byte_length": 3030,
      "sha256": "aaaaaaaaaaaaaaaaaaaaaaaaaaaaaaaaaaaaaaaaaaaaaaaaaaaaaaaaaaaaaaaa",
      "media_type": "application/json"
    },
    "preflight_record": {
      "role": "redb-prescreen-actual-preflight-record",
      "byte_length": 3131,
      "sha256": "bbbbbbbbbbbbbbbbbbbbbbbbbbbbbbbbbbbbbbbbbbbbbbbbbbbbbbbbbbbbbbbb",
      "media_type": "application/json"
    }
  },
  "run_window": {
    "started_at_utc": "2026-07-23T13:00:00Z",
    "ended_at_utc": "2026-07-23T13:01:00Z",
    "duration_ns": 60000000000
  },
  "schedule_summary": {
    "planned_attempts": 3,
    "executed_attempts": 3,
    "valid_attempts": 3,
    "invalid_attempts": 0,
    "retained_transaction_samples": 100,
    "retained_artifact_bytes": 65536
  },
  "bounds": {
    "hard_bound_hit": false,
    "hit_codes": []
  },
  "disposition": "DEFER",
  "artifacts": {
    "raw_run_manifest": {
      "role": "redb-prescreen-raw-run-manifest",
      "byte_length": 3232,
      "sha256": "cccccccccccccccccccccccccccccccccccccccccccccccccccccccccccccccc",
      "media_type": "application/json"
    },
    "artifact_index": {
      "role": "redb-prescreen-artifact-index",
      "byte_length": 3333,
      "sha256": "dddddddddddddddddddddddddddddddddddddddddddddddddddddddddddddddd",
      "media_type": "application/json"
    },
    "independent_validator_report": {
      "role": "redb-prescreen-independent-validator-report",
      "byte_length": 3434,
      "sha256": "eeeeeeeeeeeeeeeeeeeeeeeeeeeeeeeeeeeeeeeeeeeeeeeeeeeeeeeeeeeeeeee",
      "media_type": "application/json"
    },
    "oracle_report": {
      "role": "redb-prescreen-independent-oracle-report",
      "byte_length": 3535,
      "sha256": "ffffffffffffffffffffffffffffffffffffffffffffffffffffffffffffffff",
      "media_type": "application/json"
    }
  },
  "mechanism_probe": null,
  "owners": {
    "workload_owner": {
      "role": "workload_owner",
      "owner_id": "workload-owner/synthetic-fixture.invalid",
      "decision": "accept_reviewed_result",
      "reviewed_at_utc": "2026-07-23T14:00:00Z",
      "attestation": {
        "role": "redb-prescreen-workload-owner-post-run-attestation",
        "byte_length": 3636,
        "sha256": "1234567890abcdef1234567890abcdef1234567890abcdef1234567890abcdef",
        "media_type": "application/json"
      }
    },
    "operations_owner": {
      "role": "operations_owner",
      "owner_id": "operations-owner/synthetic-fixture.invalid",
      "decision": "accept_reviewed_result",
      "reviewed_at_utc": "2026-07-23T14:01:00Z",
      "attestation": {
        "role": "redb-prescreen-operations-owner-post-run-attestation",
        "byte_length": 3737,
        "sha256": "abcdef0123456789abcdef0123456789abcdef0123456789abcdef0123456789",
        "media_type": "application/json"
      }
    }
  },
  "evidence_scope": {
    "prescreen_only": true,
    "qualification_eligible": false,
    "candidate_admission_eligible": false,
    "backend_selection_eligible": false,
    "production_eligible": false,
    "independent_soak_eligible": false,
    "c1_c2_c3_eligible": false,
    "fault_endurance_eligible": false,
    "checkpoint_exactly_once_eligible": false,
    "source_sink_delivery_eligible": false
  }
}
